{
  "id": "mkt_translate_hindi",
  "name": "Translate to Hindi",
  "description": "Translate text from any language into natural Hindi",
  "icon": "Languages",
  "color": "#FF9933",
  "promptTemplate": "Translate the following text into natural, fluent Hindi (Devanagari script). Preserve the meaning, tone, and formatting of the original. If the text is already in Hindi, return it unchanged:\n\n\"{{input}}\"\n\nIMPORTANT: Return ONLY the Hindi translation. Do NOT include any introductory notes or explanations.",
  "category": "marketplace",
  "version": "1.0.0",
  "author": "hone-team",
  "tags": ["translation", "language", "hindi"]
}
