{
  "id": "mkt_remove_jargon",
  "name": "Remove jargon",
  "description": "Replace buzzwords and jargon with plain language",
  "icon": "Eraser",
  "color": "#10B981",
  "promptTemplate": "Rewrite the following text in plain language. Replace jargon, buzzwords, and corporate-speak with clear everyday words while preserving the exact meaning and tone:\n\n\"{{input}}\"\n\nIMPORTANT: Return ONLY the rewritten text. Do NOT include any introductory notes, explanations, or markdown wrappers.",
  "category": "marketplace",
  "version": "1.0.0",
  "author": "hone-team",
  "tags": ["clarity", "simplify", "business"]
}
