{
  "id": "mkt_translate_japanese",
  "name": "Translate to Japanese",
  "description": "Translate text from any language into natural Japanese",
  "icon": "Languages",
  "color": "#EC4899",
  "promptTemplate": "Translate the following text into natural, fluent Japanese. Preserve the meaning, tone, and formatting of the original. If the text is already in Japanese, return it unchanged:\n\n\"{{input}}\"\n\nIMPORTANT: Return ONLY the Japanese translation. Do NOT include any introductory notes or explanations.",
  "category": "marketplace",
  "version": "1.0.0",
  "author": "hone-team",
  "tags": ["translation", "language", "japanese"]
}
