{
  "id": "mkt_translate_spanish",
  "name": "Translate to Spanish",
  "description": "Translate text from any language into natural Spanish",
  "icon": "Languages",
  "color": "#22C55E",
  "promptTemplate": "Translate the following text into natural, fluent Spanish. Preserve the meaning, tone, and formatting of the original. If the text is already in Spanish, return it unchanged:\n\n\"{{input}}\"\n\nIMPORTANT: Return ONLY the Spanish translation. Do NOT include any introductory notes or explanations.",
  "category": "marketplace",
  "version": "1.0.0",
  "author": "hone-team",
  "tags": ["translation", "language", "spanish"]
}
