{
  "id": "mkt_translate_german",
  "name": "Translate to German",
  "description": "Translate text from any language into natural German",
  "icon": "Languages",
  "color": "#0EA5E9",
  "promptTemplate": "Translate the following text into natural, fluent German. Preserve the meaning, tone, and formatting of the original. If the text is already in German, return it unchanged:\n\n\"{{input}}\"\n\nIMPORTANT: Return ONLY the German translation. Do NOT include any introductory notes or explanations.",
  "category": "marketplace",
  "version": "1.0.0",
  "author": "hone-team",
  "tags": ["translation", "language", "german"]
}
